,Unnamed: 0,ISBN,Book-Rating,Book-Title,Book-Author,Year-Of-Publication,Publisher,Image-URL-S,Image-URL-M,Image-URL-L,Content
117,121,0440213525,2.462068965517241,The Client,John Grisham,1994,Dell Publishing Company,http://images.amazon.com/images/P/0440213525.01.THUMBZZZ.jpg,http://images.amazon.com/images/P/0440213525.01.MZZZZZZZ.jpg,http://images.amazon.com/images/P/0440213525.01.LZZZZZZZ.jpg,"
In the two years since The Firm first captured the imagination of America's readers, John Grisham, with three consecutive number-one bestsellers, has become one of the most popular authors of our time. Now, in The Client, he has written a novel so irresistible, so thoroughly entertaining and satisfying, that it is sure not only to please his millions of fans, but to win him new ones as well. This is the story of eleven-year-old Mark Sway, who, as the novel opens, witnesses the bizarre suicide of a New Orleans attorney. Just before he dies, the lawyer tells Mark a deadly secret concerning the recent murder of a Louisiana Senator, whose accused killer, Mafia thug Barry Muldanno, is about to go to trial. The police, the federal prosecutor and the FBI pressure Mark to tell them the attorney's last words, but he knows that with the mob watching his every move, revealing his secret will almost surely get him killed. So Mark, streetwise and old beyond his years, hires a lawyer: Reggie Love, a fifty-two-year-old divorcee who's been through more than anyone could imagine and survived, basically, because she's tough. And feisty. And loves helping kids overlooked or abused by the system. But when Mark's life is threatened, and Reggie discovers her office has been bugged, and even the Juvenile Court judge says Mark has no choice but to talk, she realizes that this time she's in way over her head. But then Mark comes up with a plan... a crazy plan, in Reggie's opinion, but it's their only hope. And it just might work. With the page-turning suspense and terrific plot twists that have become John Grisham's trademark, he has once again crafted a novel that simply cannot be put down. But in The ClientGrisham has gone a step further - with a cast of unforgettable characters headed by the most original hero in years, he has mixed equal parts humor and warmth to truly expand the boundaries of the legal thriller.
The Client is a legal thriller written by American author John Grisham, set mostly in Memphis, Tennessee, and New Orleans, Louisiana. It is Grisham's fourth novel.
"
118,122,0451156609,2.4583333333333335,The Tommyknockers,Stephen King,1994,Signet Book,http://images.amazon.com/images/P/0451156609.01.THUMBZZZ.jpg,http://images.amazon.com/images/P/0451156609.01.MZZZZZZZ.jpg,http://images.amazon.com/images/P/0451156609.01.LZZZZZZZ.jpg,"
Master storyteller Stephen King presents the classic, terrifying #1 New York Times bestseller about a terrifying otherworldly discovery and the effects it has a on a small town.

“Late last night and the night before, Tommyknockers, Tommyknockers, knocking at the door…”

On a beautiful June day, while walking deep in the woods on her property in Haven, Maine, Bobbi Anderson quite literally stumbles over her own destiny and that of the entire town. For the dull gray metal protrusion she discovers in the ground is part of a mysterious and massive metal object, one that may have been buried there for millennia. Bobbi can’t help but become obsessed and try to dig it out…the consequences of which will affect and transmute every citizen of Haven, young and old. It means unleashing extraordinary powers beyond those of mere mortals—and certain death for any and all outsiders. An alien hell has now invaded this small New England town…an aggressive and violent malignancy devoid of any mercy or sanity…

“Wonderful creeping terror…a great storyteller!”—The New York Times Book Review

“Brilliant, riveting, marvelous.”—Boston Globe

“King at his best!” —San Francisco Chronicle
The Tommyknockers is a 1987 science fiction novel by Stephen King. While maintaining a horror style, the novel is an excursion into the realm of science fiction for King, as the residents of the Maine town of Haven gradually fall under the influence of a mysterious object buried in the woods.
"
119,123,0446672211,2.448087431693989,Where the Heart Is (Oprah's Book Club (Paperback)),Billie Letts,1998,Warner Books,http://images.amazon.com/images/P/0446672211.01.THUMBZZZ.jpg,http://images.amazon.com/images/P/0446672211.01.MZZZZZZZ.jpg,http://images.amazon.com/images/P/0446672211.01.LZZZZZZZ.jpg,"
Talk about unlucky sevens. An hour ago, seventeen-year-old, seven months pregnant Novalee Nation was heading for California with her boyfriend. Now she finds herself stranded at a Wal-Mart in Sequoyah, Oklahoma, with just $7.77 in change. But Novalee is about to discover hidden treasures in this small Southwest town--a group of down-to-earth, deeply caring people willing to help a homeless, jobless girl living secretly in a Wal-Mart. From Bible-thumping blue-haired Sister Thelma Husband to eccentric librarian Forney Hull who loves Novalee more than she loves herself, they are about to take her--and you, too--on a moving, funny, and unforgettable journey to . . . Where the Heart Is.
Where the Heart Is is a 1995 novel by Billie Letts. It was chosen as an Oprah's Book Club selection in December 1998.
"
120,124,155874262X,2.445945945945946,Chicken Soup for the Soul (Chicken Soup for the Soul),Jack Canfield,1993,Health Communications,http://images.amazon.com/images/P/155874262X.01.THUMBZZZ.jpg,http://images.amazon.com/images/P/155874262X.01.MZZZZZZZ.jpg,http://images.amazon.com/images/P/155874262X.01.LZZZZZZZ.jpg,"Grandparents and grandchildren will enjoy Chicken Soup for the Soul: Grand and Great with its 101 stories written by grandparents about their grandchildren and by grateful grandchildren about their grandparents.

A parent becomes a new person the day the first grandchild is born. Formerly serious adults become grandparents who dote on their grandchildren and find new delight in life. This new book includes the best stories on being a grandparent from Chicken Soup for the Soul’s library. Everyone can understand the special ties between grandparents and grandchildren -- the unlimited love, the mutual admiration and unqualified acceptance. Printed in a larger font.
"
121,125,0515128546,2.4430379746835444,Tears of the Moon (Irish Trilogy),Nora Roberts,2000,Jove Books,http://images.amazon.com/images/P/0515128546.01.THUMBZZZ.jpg,http://images.amazon.com/images/P/0515128546.01.MZZZZZZZ.jpg,http://images.amazon.com/images/P/0515128546.01.LZZZZZZZ.jpg,"No one understands why Shawn Gallagher doesn't put his musical gift to profitable use, least of all Brenna O'Toole, a tomboy who has been in love with him for years. Only when Shawn gives into the mysteries of magic will he fulfill his destiny as a man and a musician.
"
122,126,089480829X,2.440677966101695,What to Expect When You're Expecting (Revised Edition),Arlene Eisenberg,1996,Workman Pub Co,http://images.amazon.com/images/P/089480829X.01.THUMBZZZ.jpg,http://images.amazon.com/images/P/089480829X.01.MZZZZZZZ.jpg,http://images.amazon.com/images/P/089480829X.01.LZZZZZZZ.jpg,"
Announcing a brand new, cover-to-cover revision of America's pregnancy bible. What to Expect When You're Expecting is a perennial New York Times bestseller and one of USA Today's 25 most influential books of the past 25 years. It's read by more than 90% of pregnant women who read a pregnancy book—the most iconic, must-have book for parents-to-be, with over 14.5 million copies in print.

Now comes the Fourth Edition, a new book for a new generation of expectant moms—featuring a new look, a fresh perspective, and a friendlier-than-ever voice. It's filled with the most up-to-date information reflecting not only what's new in pregnancy, but what's relevant to pregnant women. Heidi Murkoff has rewritten every section of the book, answering dozens of new questions and including loads of new asked-for material, such as a detailed week-by-week fetal development section in each of the monthly chapters, an expanded chapter on pre-conception, and a brand new one on carrying multiples. More comprehensive, reassuring, and empathetic than ever, the Fourth Edition incorporates the most recent developments in obstetrics and addresses the most current lifestyle trends (from tattooing and belly piercing to Botox and aromatherapy). There's more than ever on pregnancy matters practical (including an expanded section on workplace concerns), physical (with more symptoms, more solutions), emotional (more advice on riding the mood roller coaster), nutritional (from low-carb to vegan, from junk food–dependent to caffeine-addicted), and sexual (what's hot and what's not in pregnant lovemaking), as well as much more support for that very important partner in parenting, the dad-to-be.

Overflowing with tips, helpful hints, and humor (a pregnant woman's best friend), this new edition is more accessible and easier to use than ever before. It's everything parents-to-be have come to expect from What to Expect...only better?.
"
123,127,0345337662,2.414772727272727,Interview with the Vampire,Anne Rice,1993,Ballantine Books,http://images.amazon.com/images/P/0345337662.01.THUMBZZZ.jpg,http://images.amazon.com/images/P/0345337662.01.MZZZZZZZ.jpg,http://images.amazon.com/images/P/0345337662.01.LZZZZZZZ.jpg,"
From #1 New York Times bestselling author Anne Rice, this sensuously written spellbinding classic remains 'the most successful vampire story since Bram Stoker's Dracula' (The Times)

In a darkened room a young man sits telling the macabre and eerie story of his life - the story of a vampire, gifted with eternal life, cursed with an exquisite craving for human blood. Anne Rice's compulsively readable novel is arguably the most celebrated work of vampire fiction since Bram Stoker's Dracula was published in 1897.

When Interview with the Vampire was originally published the Washington Post said it was: called Interview with the Vampire a 'thrilling, strikingly original work of the imagination . . . sometimes horrible, sometimes beautiful, always unforgettable'. Now, more than forty years since its release, Anne Rice's masterpiece is more beloved than ever.
Interview with the Vampire is a gothic horror and vampire novel by American author Anne Rice, published in 1976. It was her debut novel. Based on a short story Rice wrote around 1968, the novel centers on vampire Louis de Pointe du Lac, who tells the story of his life to a reporter.
"
124,128,0345348036,2.39622641509434,The Princess Bride: S Morgenstern's Classic Tale of True Love and High Adventure,WILLIAM GOLDMAN,1987,Del Rey,http://images.amazon.com/images/P/0345348036.01.THUMBZZZ.jpg,http://images.amazon.com/images/P/0345348036.01.MZZZZZZZ.jpg,http://images.amazon.com/images/P/0345348036.01.LZZZZZZZ.jpg,"
As Florin and Gulder teeter on the verge of war, the reluctant Princess Buttercup is devastated by the loss of her true love, kidnapped by a mercenary and his henchmen. She is rescued by a pirate, forced to marry Prince Humperdinck, and rescued once again by the very crew who absconded with her in the first place. In the course of this adventure, you'll meet Vizzini, the evil Sicilian & criminal philosopher who'll do anything for a bag of gold; Fezzik, the Turk, the gentle giant; Inigo, the Spanish swordsman who lives only to avenge his father's death; Westley, princess Buttercup's one true love and a very good friend of a very dangerous pirate; Prince Humperdinck, the eviler ruler of Guilder, who has an equally insatiable thirst for war and the beauteous Buttercup; Miracle Max, the King's ex-Miracle Man, who can raise the dead (kind of); The Dread Pirate Roberts, supreme looter and plunderer of the high seas; and Count Rugen, the evil mastermind behind it all; and, of course, Buttercup, the princess bride, the most perfect, beautiful woman in the history of the world. This timeless tale pits country against country, good against evil, love against hate. From the Cliffs of Insanity through the Fire Swamp and down into the Zoo of Death, this incredible journey and brilliant tale is peppered with strange beasties monstrous and gentle, and memorable surprises both terrible and sublime. -- Publisher description.
The Princess Bride: S. Morgenstern's Classic Tale of True Love and High Adventure, The ""Good Parts"" Version is a 1973 fantasy romance novel by American writer William Goldman. The book combines elements of comedy, adventure, fantasy, drama, romance, and fairy tale.
"
125,129,0374199698,2.388888888888889,Middlesex: A Novel,Jeffrey Eugenides,2002,"Farrar, Straus and Giroux",http://images.amazon.com/images/P/0374199698.01.THUMBZZZ.jpg,http://images.amazon.com/images/P/0374199698.01.MZZZZZZZ.jpg,http://images.amazon.com/images/P/0374199698.01.LZZZZZZZ.jpg,"
'I was born twice: first, as a baby girl, on a remarkably smogless Detroit day of January 1960; and then again, as a teenage boy, in an emergency room near Petoskey, Michigan, in August of l974 ...My birth certificate lists my name as Calliope Helen Stephanides. My most recent driver's license ... records my first name simply as Cal.' So begins the breathtaking story of Calliope Stephanides, and three generations of the Greek-American Stephanides family who travel from a tiny village overlooking Mount Olympus in Asia Minor to Prohibition era Detroit, witnessing its glory days as the Motor City, and the race riots of l967, before they move out to the tree-lined streets of suburban Grosse Point, Michigan. To understand why Calliope is not like other girls, she has to uncover a guilty family secret, and the astonishing genetic history that turns Callie into Cal, one of the most audacious and wondrous narrators in contemporary fiction. Lyrical and thrilling, Middlesex is an exhilarating reinvention of the American epic.
Middlesex is a Pulitzer Prize–winning novel by Jeffrey Eugenides published in 2002. The book is a bestseller, with more than four million copies sold since its publication. Its characters and events are loosely based on aspects of Eugenides' life and observations of his Greek heritage.
"
126,130,0385479565,2.3866666666666667,The Hot Zone,Richard Preston,1995,Anchor,http://images.amazon.com/images/P/0385479565.01.THUMBZZZ.jpg,http://images.amazon.com/images/P/0385479565.01.MZZZZZZZ.jpg,http://images.amazon.com/images/P/0385479565.01.LZZZZZZZ.jpg,"
NEW YORK TIMES BESTSELLER • The bestselling landmark account of the first emergence of the Ebola virus. • ""This work of nonfiction is more terrifying than any sci-fi nightmare."" —USA TODAY

Also a mini-series drama starring Julianna Margulies, Topher Grace, Liam Cunningham, James D'Arcy, and Noah Emmerich on National Geographic.

A highly infectious, deadly virus from the central African rain forest suddenly appears in the suburbs of Washington, D.C. There is no cure. In a few days 90 percent of its victims are dead. A secret military SWAT team of soldiers and scientists is mobilized to stop the outbreak of this exotic ""hot"" virus. The Hot Zone tells this dramatic story, giving a hair-raising account of the appearance of rare and lethal viruses and their ""crashes"" into the human race. Shocking, frightening, and impossible to ignore, The Hot Zone proves that truth really is scarier than fiction.
The Hot Zone: A Terrifying True Story is a best-selling 1994 nonfiction thriller by Richard Preston about the origins and incidents involving viral hemorrhagic fevers, particularly ebolaviruses and marburgviruses. The basis of the book was Preston's 1992 New Yorker article ""Crisis in the Hot Zone"".
"
127,131,0451160525,2.3833333333333333,"The Gunslinger (The Dark Tower, Book 1)",Stephen King,1994,New American Library,http://images.amazon.com/images/P/0451160525.01.THUMBZZZ.jpg,http://images.amazon.com/images/P/0451160525.01.MZZZZZZZ.jpg,http://images.amazon.com/images/P/0451160525.01.LZZZZZZZ.jpg,"
Now a major motion picture starring Matthew McConaughey and Idris Elba

“An impressive work of mythic magnitude that may turn out to be Stephen King’s greatest literary achievement” (The Atlanta Journal-Constitution), The Gunslinger is the first volume in the epic Dark Tower Series.

A #1 national bestseller, The Gunslinger introduces readers to one of Stephen King’s most powerful creations, Roland of Gilead: The Last Gunslinger. He is a haunting figure, a loner on a spellbinding journey into good and evil. In his desolate world, which mirrors our own in frightening ways, Roland tracks The Man in Black, encounters an enticing woman named Alice, and begins a friendship with the boy from New York named Jake.

Inspired in part by the Robert Browning narrative poem, “Childe Roland to the Dark Tower Came,” The Gunslinger is “a compelling whirlpool of a story that draws one irretrievable to its center” (Milwaukee Sentinel). It is “brilliant and fresh…and will leave you panting for more” (Booklist).
The Gunslinger is a dark-fantasy novel by American author Stephen King. It is the first volume in the Dark Tower series. The Gunslinger was first published in 1982 as a fix-up novel, joining five short stories that had been published between 1978 and 1981.
"
128,132,0671042858,2.373134328358209,The Girl Who Loved Tom Gordon,Stephen King,2000,Pocket,http://images.amazon.com/images/P/0671042858.01.THUMBZZZ.jpg,http://images.amazon.com/images/P/0671042858.01.MZZZZZZZ.jpg,http://images.amazon.com/images/P/0671042858.01.LZZZZZZZ.jpg,"
The acclaimed #1 New York Times bestseller from Stephen King—uniquely frightening suspense about a young girl lost in the woods as night falls, with only the voice of her beloved Red Sox relief pitcher to sustain her and help her survive—maybe.

During a six-mile hike on the Maine-New Hampshire branch of the Appalachian Trail, nine-year-old Trisha McFarland quickly tires of the constant bickering between her older brother and her recently divorced mother. But when she wanders off by herself, she becomes lost in a wilderness maze full of peril and terror. As night falls, Trisha has only her ingenuity as a defense against the elements, and only her courage and faith to withstand her mounting fears. For solace she tunes her headphones to broadcasts of Boston Red Sox baseball games and follows the gritty performances of her hero, relief pitcher Tom Gordon. And when the reception begins to fade, Trisha imagines that Tom Gordon is with her—the protector from an enemy who may or may not be imagined…one who is watching her, waiting for her in the dense, dark woods…
The Girl Who Loved Tom Gordon is a psychological horror novel by American writer Stephen King. In 2004, a pop-up book adaptation was released with design by Kees Moerbeek and illustration by Alan Dingman. A film adaptation to be produced by Chris Romero was announced in 2019.
"
129,133,0156027321,2.371212121212121,Life of Pi,Yann Martel,2003,Harvest Books,http://images.amazon.com/images/P/0156027321.01.THUMBZZZ.jpg,http://images.amazon.com/images/P/0156027321.01.MZZZZZZZ.jpg,http://images.amazon.com/images/P/0156027321.01.LZZZZZZZ.jpg,"
WINNER OF THE BOOKER PRIZE

One boy. One boat. One tiger.   
After the tragic sinking of a cargo ship, a solitary lifeboat remains bobbing on the wild, blue Pacific. The only survivors from the wreck are a sixteen-year-old boy named Pi, a hyena, a zebra (with a broken leg), a female orangutan—and a 450-pound Royal Bengal tiger. The scene is set for one of the most extraordinary and beloved works of fiction in recent years.
Life of Pi is a Canadian philosophical novel by Yann Martel published in 2001. The protagonist is Piscine Molitor ""Pi"" Patel, an Indian boy from Pondicherry, India, who explores issues of spirituality and metaphysics from an early age.
"
130,134,0451184963,2.3661971830985915,Insomnia,Stephen King,1995,Signet Book,http://images.amazon.com/images/P/0451184963.01.THUMBZZZ.jpg,http://images.amazon.com/images/P/0451184963.01.MZZZZZZZ.jpg,http://images.amazon.com/images/P/0451184963.01.LZZZZZZZ.jpg,"
Ralph Roberts has a problem: he isn't sleeping so well these days. In fact, he's hardly sleeping at all. Each morning, the news conveyed by the bedside clock is a little worse: 3:15...3:02...2:45...2:15. The books call it ""premature waking""; Ralph, who is still learning to be a widower, calls it a season in hell. He's begun to notice a strangeness in his familiar surroundings, to experience visual phenomena that he can't quite believe are hallucinations. Soon, Ralph thinks, he won't be sleeping at all, and what then? A problem, yes - though perhaps not so uncommon, you might say. But Ralph has lived his entire life in Derry, Maine, and Derry isn't like other places, as millions of Stephen King readers will gladly testify. They remember It, also set in Derry, and know there's a mean streak running through this small New England city; underneath its ordinary surface awesome and terrifying forces are at work. The dying, natural and otherwise, has been going on in Derry for a long, long time. Now Ralph is part of it. So are his friends. And so are the strangers they encounter.
Insomnia is a 1994 horror/fantasy novel by American writer Stephen King. It follows retired widower Ralph Roberts whose increasing insomnia allows him to perceive auras and other hidden things, leading him to join a conflict between the forces of the Purpose and the Random.
"
131,135,0140298479,2.3661971830985915,Bridget Jones: The Edge of Reason,Helen Fielding,2001,Penguin Books,http://images.amazon.com/images/P/0140298479.01.THUMBZZZ.jpg,http://images.amazon.com/images/P/0140298479.01.MZZZZZZZ.jpg,http://images.amazon.com/images/P/0140298479.01.LZZZZZZZ.jpg,"
9st 2, cigarettes smoked in front of Mark 0 (v.g.), cigarettes smoked in secret 7, cigarettes not smoked 47 (v.g.).
Bridget’s second diary ushers in a reformed woman. She is no longer a smoker (well, not much), the wilderness years are over and Bridget is at last united with man-of-her-dreams Mark Darcy. But things aren’t perfect: there’s an eight-foot hole in the wall of her flat, she’s increasingly worried about a certain boyfriend-stealing beauty and her friends’ mad advice is getting her nowhere – something has to change. And so Bridget decides to embark on a spiritual epiphany to the palm- and magic-mushroom-kissed shores of Thailand. Surely it will be the perfect place to set her life on course once and for all . . .
Bridget Jones: The Edge of Reason is Bridget at her best: funny, wise and as ever, a little bit sloshed. A number-one bestseller, it is, alongside Bridget Jones’s Diary, a modern classic and one of the funniest books you’ll ever read.
‘Glorious . . . there is a laugh on every page’ Sunday Times
‘The best, the original, the seminal’ Mail on Sunday
Bridget Jones: The Edge of Reason is a 1999 novel by Helen Fielding, a sequel to her popular Bridget Jones' Diary. It chronicles Bridget Jones's adventures after she begins to suspect that her boyfriend, Mark Darcy, is falling for a rich young solicitor who works in the same firm as him, a woman called Rebecca.
"
132,136,1400034779,2.3529411764705883,The No. 1 Ladies' Detective Agency (Today Show Book Club #8),Alexander McCall Smith,2003,Anchor,http://images.amazon.com/images/P/1400034779.01.THUMBZZZ.jpg,http://images.amazon.com/images/P/1400034779.01.MZZZZZZZ.jpg,http://images.amazon.com/images/P/1400034779.01.LZZZZZZZ.jpg,"
NATIONAL BESTSELLER • Fans around the world adore the bestselling No. 1 Ladies’ Detective Agency series and its proprietor, Precious Ramotswe, Botswana’s premier lady detective. In this charming series, Mma  Ramotswe—with help from her loyal associate, Grace Makutsi—navigates her cases and her personal life with wisdom, good humor, and the occasional cup of tea.

This first novel in Alexander McCall Smith’s widely acclaimed The No. 1 Ladies Detective Agency series tells the story of the delightfully cunning and enormously engaging Precious Ramotswe, who is drawn to her profession to “help people with problems in their lives.” Immediately upon setting up shop in a small storefront in Gaborone, she is hired to track down a missing husband, uncover a con man, and follow a wayward daughter. But the case that tugs at her heart, and lands her in danger, is a missing eleven-year-old boy, who may have been snatched by witchdoctors.

The No. 1 Ladies’ Detective Agency received two Booker Judges’ Special Recommendations and was voted one of the International Books of the Year and the Millennium by the Times Literary Supplement.
The No. 1 Ladies' Detective Agency is the first detective novel in the eponymous series by Scottish author Alexander McCall Smith, first published in 1998.
"
