,Unnamed: 0,ISBN,Book-Rating,Book-Title,Book-Author,Year-Of-Publication,Publisher,Image-URL-S,Image-URL-M,Image-URL-L,Content
378,386,0553275976,1.441860465116279,The Bonfire of the Vanities,Tom Wolfe,1988,Bantam Books,http://images.amazon.com/images/P/0553275976.01.THUMBZZZ.jpg,http://images.amazon.com/images/P/0553275976.01.MZZZZZZZ.jpg,http://images.amazon.com/images/P/0553275976.01.LZZZZZZZ.jpg,"
An exhilarating satire of Eighties excess that captures the effervescent spirit of New York, from one of the greatest writers of modern American prose
Sherman McCoy is a WASP, bond trader and self-appointed 'Master of the Universe'. He has a fashionable wife, a Park Avenue apartment and a Southern mistress. His spectacular fall begins the moment he is involved in a hit-and-run accident in the Bronx. Prosecutors, newspaper hacks, politicians and clergy close in on him, determined to bring him down.
Exuberant, scandalous and exceptionally discerning, The Bonfire of the Vanities was Tom Wolfe's first venture into fiction and cemented his reputation as the foremost chronicler of his age.
‘The air of New York crackles with an energy that causes the adrenalin to pump... The feeling is perfectly reproduced in Wolfe's novel... Electric’ Sunday Times
‘The quintessential novel of The Eighties’ The Guardian
The Bonfire of the Vanities is a 1987 novel by Tom Wolfe. The story is a drama about ambition, racism, social class, politics, and greed in 1980s New York City, and centers on three main characters: ...
"
379,387,0446604801,1.4415584415584417,Jack &amp; Jill (Alex Cross Novels),James Patterson,1997,Warner Books,http://images.amazon.com/images/P/0446604801.01.THUMBZZZ.jpg,http://images.amazon.com/images/P/0446604801.01.MZZZZZZZ.jpg,http://images.amazon.com/images/P/0446604801.01.LZZZZZZZ.jpg,"
SOON TO BE AN ORIGINAL AMAZON PRIME SERIES

________________________________________

'No one gets this big without amazing natural storytelling talent - which is what Jim has, in spades. The Alex Cross series proves it.' LEE CHILD
____________________________________

Detective Alex Cross is stretched to breaking point as two killers hit Washington, DC

A controversial senator is found murdered in his bed. On the other side of town, a young girl has been savagely killed. Under pressure to solve both cases, Cross is faced with an impossible choice.

No one in Washington is safe, but can Cross discover the truth before the killers set their sights on their ultimate target?
____________________________________

'Alex Cross is a legend' HARLAN COBEN

'Fine, full-blooded entertainment from start to finish' PUBLISHERS WEEKLY

'Captivating . . . As always, Patterson provides a fast-paced thriller full of surprising but realistic plot twists . . . Cross is one of the best and most likable characters in the modern thriller genre' SAN FRANCISCO EXAMINER

'The master storyteller of our times' HILLARY RODHAM CLINTON

'It's no mystery why James Patterson is the world's most popular thriller writer . . . Simply put: nobody does it better.' JEFFERY DEAVER

'Patterson boils a scene down to the single, telling detail, the element that defines a character or moves a plot along. It's what fires off the movie projector in the reader's mind.' MICHAEL CONNELLY

'One of the greatest storytellers of all time' PATRICIA CORNWELL

'A writer with an unusual skill at thriller plotting.' MARK LAWSON, GUARDIAN

'James Patterson is The Boss. End of.' IAN RANKIN
"
380,388,0345353145,1.4385964912280702,Sphere,MICHAEL CRICHTON,1988,Ballantine Books,http://images.amazon.com/images/P/0345353145.01.THUMBZZZ.jpg,http://images.amazon.com/images/P/0345353145.01.MZZZZZZZ.jpg,http://images.amazon.com/images/P/0345353145.01.LZZZZZZZ.jpg,"
From the author of Jurassic Park, Timeline, and Congo comes a psychological thriller about a group of scientists who investigate a spaceship discovered on the ocean floor.
 
In the middle of the South Pacific, a thousand feet below the surface, a huge vessel is unearthed. Rushed to the scene is a team of American scientists who descend together into the depths to investigate the astonishing discovery. What they find defies their imaginations and mocks their attempts at logical explanation. It is a spaceship, but apparently it is undamaged by its fall from the sky. And, most startling, it appears to be at least three hundred years old, containing a terrifying and destructive force that must be controlled at all costs.
 
Sphere is a 1987 novel by Michael Crichton, his sixth novel under his own name and his sixteenth overall. It was adapted into the film Sphere in 1998.
"
381,389,0440234743,1.435483870967742,The Testament,John Grisham,1999,Dell,http://images.amazon.com/images/P/0440234743.01.THUMBZZZ.jpg,http://images.amazon.com/images/P/0440234743.01.MZZZZZZZ.jpg,http://images.amazon.com/images/P/0440234743.01.LZZZZZZZ.jpg,"The lives of a self-made billionaire looking for a way to die, a high powered Washington lawyer and a religious young woman working with Indians in the jungles of Brazil are forever changed by the startling secret of The Testament. A story that combines legal suspense with remarkable adventure. One of GrishamA A*s best!
"
382,390,080411109X,1.4252873563218391,The Hundred Secret Senses,Amy Tan,1996,Ivy Books,http://images.amazon.com/images/P/080411109X.01.THUMBZZZ.jpg,http://images.amazon.com/images/P/080411109X.01.MZZZZZZZ.jpg,http://images.amazon.com/images/P/080411109X.01.LZZZZZZZ.jpg,"
The Hundred Secret Senses is an exultant novel about China and America, love and loyalty, the identities we invent and the true selves we discover along the way. Olivia Laguni is half-Chinese, but typically American in her uneasiness with her patchwork family. And no one in Olivia's family is more embarrassing to her than her half-sister, Kwan Li. For Kwan speaks mangled English, is cheerfully deaf to Olivia's sarcasm, and sees the dead with her ""yin eyes.""

Even as Olivia details the particulars of her decades-long grudge against her sister (who, among other things, is a source of infuriatingly good advice), Kwan Li is telling her own story, one that sweeps us into the splendor, squalor, and violence of Manchu China. And out of the friction between her narrators, Amy Tan creates a work that illuminates both the present and the past sweetly, sadly, hilariously, with searing and vivid prose.

""Truly magical...unforgettable...this novel...shimmer[s] with meaning.""--San Diego Tribune

""The Hundred Secret Senses doesn't simply return to a world but burrows more deeply into it, following new trails to fresh revelations.""--Newsweek
The Hundred Secret Senses is a bestselling 1995 novel by Chinese-American writer Amy Tan. It was published by Putnam, and was shortlisted for the 1996 Orange Prize for Fiction. While the story is fictional, it is based on the experiences of Tan and on stories told by her mother.
"
383,391,0375502238,1.4074074074074074,Blessings,ANNA QUINDLEN,2002,Random House,http://images.amazon.com/images/P/0375502238.01.THUMBZZZ.jpg,http://images.amazon.com/images/P/0375502238.01.MZZZZZZZ.jpg,http://images.amazon.com/images/P/0375502238.01.LZZZZZZZ.jpg,"One night a young couple sneak onto the estate of wealthy Lydia Blessing and leave a box in the driveway. In the box is a baby and Skip Cuddy, the caretaker who finds her decides secretly to keep her. When Lydia Blessing discovers this she has choices to make, as she had many years before.
"
384,392,0060930535,1.406015037593985,The Poisonwood Bible: A Novel,Barbara Kingsolver,1999,Perennial,http://images.amazon.com/images/P/0060930535.01.THUMBZZZ.jpg,http://images.amazon.com/images/P/0060930535.01.MZZZZZZZ.jpg,http://images.amazon.com/images/P/0060930535.01.LZZZZZZZ.jpg,"
New York Times Bestseller • Finalist for the Pulitzer Prize • An Oprah's Book Club Selection
“Powerful . . . [Kingsolver] has with infinitely steady hands worked the prickly threads of religion, politics, race, sin and redemption into a thing of terrible beauty.” —Los Angeles Times Book Review
The Poisonwood Bible, now celebrating its 25th anniversary, established Barbara Kingsolver as one of the most thoughtful and daring of modern writers. Taking its place alongside the classic works of postcolonial literature, it is a suspenseful epic of one family's tragic undoing and remarkable reconstruction over the course of three decades in Africa.
The story is told by the wife and four daughters of Nathan Price, a fierce, evangelical Baptist who takes his family and mission to the Belgian Congo in 1959. They carry with them everything they believe they will need from home, but soon find that all of it—from garden seeds to Scripture—is calamitously transformed on African soil.
The novel is set against one of the most dramatic political chronicles of the twentieth century: the Congo's fight for independence from Belgium, the murder of its first elected prime minister, the CIA coup to install his replacement, and the insidious progress of a world economic order that robs the fledgling African nation of its autonomy. Against this backdrop, Orleanna Price reconstructs the story of her evangelist husband's part in the Western assault on Africa, a tale indelibly darkened by her own losses and unanswerable questions about her own culpability. Also narrating the story, by turns, are her four daughters—the teenaged Rachel; adolescent twins Leah and Adah; and Ruth May, a prescient five-year-old. These sharply observant girls, who arrive in the Congo with racial preconceptions forged in 1950s Georgia, will be marked in surprisingly different ways by their father's intractable mission, and by Africa itself. Ultimately each must strike her own separate path to salvation. Their passionately intertwined stories become a compelling exploration of moral risk and personal responsibility.
The Poisonwood Bible, by Barbara Kingsolver, is a best-selling novel about a missionary family, the Prices, who in 1959 move from the U.S. state of Georgia to the village of Kilanga in the Belgian Congo, close to the Kwilu River. The novel's title refers to Bible errata.
"
385,393,0449003795,1.3975903614457832,P Is for Peril,Sue Grafton,2002,Ballantine Books,http://images.amazon.com/images/P/0449003795.01.THUMBZZZ.jpg,http://images.amazon.com/images/P/0449003795.01.MZZZZZZZ.jpg,http://images.amazon.com/images/P/0449003795.01.LZZZZZZZ.jpg,"
A New York Times Bestselling Author A Literary Guild® Main SelectionKinsey Millhone is back, and she's broke, which is why she decides to take on a missing persons case involving a rich doctor who may have repeated history by running out on his wife and child. Things heat up when she learns that the good doctor is wanted by federal fraud busters on suspicion of Medicare fraud. Grafton delivers again in this, her sixteenth novel, which takes us into a world cast in shades o black amid shafts of steel and silver -- a shadowland in which the mysterious disappearance of the doctor leads Kinsey into a dangerous maze of duplicity as she taps into the intricacies of a cunning Medicare fraud.
""P"" Is for Peril is the 16th novel in the ""Alphabet"" series of mystery novels by Sue Grafton. The novel focuses on the disappearance of Dr. Dowan Purcell, a nursing home administrator and doctor at Pacific Meadows Nursing Home, and features Kinsey Millhone, a private eye based in Santa Teresa, California.
"
386,394,0671004107,1.3962264150943395,Contact,Carl Sagan,1997,Pocket,http://images.amazon.com/images/P/0671004107.01.THUMBZZZ.jpg,http://images.amazon.com/images/P/0671004107.01.MZZZZZZZ.jpg,http://images.amazon.com/images/P/0671004107.01.LZZZZZZZ.jpg,"
Pulitzer Prize-winning author and astronomer Carl Sagan imagines the greatest adventure of all—the discovery of an advanced civilization in the depths of space.

In December of 1999, a multinational team journeys out to the stars, to the most awesome encounter in human history. Who—or what—is out there? In Cosmos, Carl Sagan explained the universe. In Contact, he predicts its future—and our own.
Contact is a 1985 hard science fiction novel by American scientist Carl Sagan. It deals with the theme of contact between humanity and a more technologically advanced, extraterrestrial life form. It ranked No. 7 on the 1985 U.S. bestseller list.
"
387,395,0345402871,1.3934426229508197,Airframe,Michael Crichton,1997,Ballantine Books,http://images.amazon.com/images/P/0345402871.01.THUMBZZZ.jpg,http://images.amazon.com/images/P/0345402871.01.MZZZZZZZ.jpg,http://images.amazon.com/images/P/0345402871.01.LZZZZZZZ.jpg,"
#1 NEW YORK TIMES BESTSELLER • From the author of Jurassic Park, Timeline, and Sphere comes this extraordinary thriller about airline safety, business intrigue, and a deadly cover-up.
 
“The pacing is fast, the suspense nonstop.”—People
 
Three passengers are dead. Fifty-six are injured. The interior cabin is virtually destroyed. But the pilot manages to land the plane.

At a moment when the issue of safety and death in the skies is paramount in the public mind, a lethal midair disaster aboard a commercial twin-jet airliner flying from Hong Kong to Denver triggers a pressured and frantic investigation.

Airframe is nonstop reading, full of the extraordinary mixture of super suspense and authentic information on a subject of compelling interest that are the hallmarks of Michael Crichton.
 
“A one-sitting read that will cause a lifetime of white-knuckled nightmares.”—The Philaelphia Inquirer
 
“The ultimate thriller . . . [Crichton’s] stories are always page-turners of the highest order. . . . [Airframe] moves like a firehouse dog chasing a red truck.”—The Denver Post
 
“Dramatically vivid.”—The New York Times
Airframe is a novel by the American writer Michael Crichton, his eleventh under his own name and twenty-first overall, first published in 1996, in hardcover, by Knopf and then in 1997, as a paperback, by Ballantine Books.
"
388,396,0671525743,1.3928571428571428,Night Whispers,Judith McNaught,1999,Pocket,http://images.amazon.com/images/P/0671525743.01.THUMBZZZ.jpg,http://images.amazon.com/images/P/0671525743.01.MZZZZZZZ.jpg,http://images.amazon.com/images/P/0671525743.01.LZZZZZZZ.jpg,"A policewoman in a small Florida community, Sloan Reynolds knows that her modest upbringing was a long way from the social whirl of Palm Beach, the world inhabited by her father and her sister, Paris. Total strangers to Sloan, they have never tried to contact her — until a sudden invitation arrives, to meet them and indulge in the Palm Beach social season.

A woman who values her investigative work, Sloan is unmoved by the long-overdue parental gesture. But when FBI agent Paul Richardson informs her that her father and his associates are suspected of fraud, conspiracy, and murder, Sloan agrees to enter into her father's life — while hiding her true profession.

Sloan's on top of her game until she meets Noah Maitland, a multinational corporate player and one of the FBI's prime suspects — and finds herself powerfully attracted to him, against her deepest instincts. When a shocking murder shatters the seductive facade of the wealth and glamour surrounding her, Sloan must maneuver through a maze of deceit and passion, to find someone to trust — and to decipher the truth behind those terrifying whispers in the dark.
"
389,397,080411868X,1.391304347826087,"Welcome to the World, Baby Girl!",Fannie Flagg,1999,Ballantine Books,http://images.amazon.com/images/P/080411868X.01.THUMBZZZ.jpg,http://images.amazon.com/images/P/080411868X.01.MZZZZZZZ.jpg,http://images.amazon.com/images/P/080411868X.01.LZZZZZZZ.jpg,"Sweeping from the gentler confines of late 1940s small town America to the tough side of the New York media circus in the '70s, Welcome to the World, Baby Girl! mines golden seams of goodness and gritty determination, prejudice and despair, love and survival, in the story of a young TV interviewer, Dena Nordstrom, whose future looks full of promise, whose present is an emotional mess, and whose past is marked by mystery.

With a cast of unforgettable characters, from the comic masterpiece that is Neighbour Dorothy (broadcasting home tips and good news to the midwest from her own front room) to the monstrosity that is Ira Wallace, TV network head - Fannie Flagg's novel is a funny, constantly surprising novel that keeps you guessing and turing the page right up to the last.
"
390,398,0345370805,1.391304347826087,How to Make an American Quilt,Whitney Otto,1992,Ballantine Books,http://images.amazon.com/images/P/0345370805.01.THUMBZZZ.jpg,http://images.amazon.com/images/P/0345370805.01.MZZZZZZZ.jpg,http://images.amazon.com/images/P/0345370805.01.LZZZZZZZ.jpg,"
“Remarkable . . . It is a tribute to an art form that allowed women self-expression even when society did not. Above all, though, it is an affirmation of the strength and power of individual lives, and the way they cannot help fitting together.”—The New York Times Book Review

An extraordinary and moving novel, How to Make an American Quilt is an exploration of women of yesterday and today, who join together in a uniquely female experience. As they gather year after year, their stories, their wisdom, their lives, form the pattern from which all of us draw warmth and comfort for ourselves.

The inspiration for the major motion picture featuring Winona Ryder, Anne Bancroft, Ellen Burstyn, and Maya Angelou

Praise for How to Make an American Quilt

“Fascinating . . . highly original . . . These are beautiful individual stories, stitched into a profoundly moving whole. . . . A spectrum of women’s experience in the twentieth century.”—Los Angeles Times

“Intensely thoughtful . . . In Grasse, a small town outside Bakersfield, the women meet weekly for a quilting circle, piercing together scraps of their husbands’ old workshirts, children’s ragged blankets, and kitchen curtains. . . . Like the richly colored, well-placed shreds that make up the substance of an American quilt, details serve to expand and illuminate these characters. . . . The book spans half a century and addresses not only [these women’s] histories but also their children’s, their lovers’, their country’s, and in the process, their gender’s.”—San Francisco Chronicle

“A radiant work of art . . . It is about mothers and daughters; it is about the estrangement and intimacy between generations. . . . A compelling tale.”—The Seattle Times
How to Make an American Quilt is the debut novel of Whitney Otto. The novel tells the intersecting stories of several generations of women who together are part of the same quilting circle in the fictional town of Grasse, California.
"
391,399,0553582127,1.3898305084745763,The Search,Iris Johansen,2001,Bantam Books,http://images.amazon.com/images/P/0553582127.01.THUMBZZZ.jpg,http://images.amazon.com/images/P/0553582127.01.MZZZZZZZ.jpg,http://images.amazon.com/images/P/0553582127.01.LZZZZZZZ.jpg,"
He strikes without warning....he kills without mercy....he's only just begun....
Iris Johansen, the New York Times bestselling author of The Killing Game and The Face of Deception, delivers a gripping new novel of breathtaking suspense and explosive adventure. It is the story of a courageous woman who is coerced into tracking down a ruthless killer--but as she hunts out her prey with stunning accuracy, she becomes the object of his wrath....
As part of an elite K-9 search and rescue team, Sarah Patrick and her golden retriever, Monty, have a gift for finding what no one else can--whether it's a survivor buried alive by an earthquake or the skeleton of a murdered child. But their latest assignment is not like the others. This time Sarah is being forced to take part in a deadly mission...by a man who knows enough about her past to ensure her cooperation. A man who won't take no for an answer. John Logan is used to getting what he wants, and what he wants now is Sarah's help. His top-secret venture has been sabotaged, its facilities destroyed, and its handpicked staff massacred. The sole survivor is being held for ransom. Logan knows that the only way to save the man--and the secrets he holds--is to find him as soon as possible.
Smart, tough, and uncompromising, Sarah is furious when she is strong-armed into joining Logan on his search. And once she takes the perilous assignment, she realizes that Logan's promises that she and Monty will be safe may not be enough to protect them. Because a killer is devising a sadistic vengeance...and he may soon find use for Sarah. Racing against time to stop the bloodshed before more victims are claimed, both Sarah and Logan will lookstraight into the heart of true evil. And when the killer's search for revenge finally ends, no one will ever be the same again.... From the Hardcover edition.
"
392,400,0440200989,1.3773584905660377,Weep No More My Lady,Mary Higgins Clark,1993,Dell,http://images.amazon.com/images/P/0440200989.01.THUMBZZZ.jpg,http://images.amazon.com/images/P/0440200989.01.MZZZZZZZ.jpg,http://images.amazon.com/images/P/0440200989.01.LZZZZZZZ.jpg,"New York Times bestselling author Mary Higgins Clark’s suspenseful masterpiece is a “crackling tale of menace and love that holds your attention to the last page” (Andrew M. Greeley).

Elizabeth Lange has arrived at Cypress Point Spa in Pebble Beach, California, weary of heart and soul. Still grieving for her beloved sister, a famous actress who plunged to her death from her Manhattan penthouse, Elizabeth is determined to unearth the truth about how Leila died.

Dashing multimillionaire Ted Winters stands accused of her murder, but Elizabeth has doubts. Along the windswept cliffs of the Monterey coast, in luxurious bungalows, between gourmet meals and beachfront walks, uneasiness stalks Elizabeth while she begins opening doors to the past.

As glimpses of the dark truth about Leila's life and death—and about Elizabeth herself—start to crash against her mind, an ominous wave from an unexpected source threatens to engulf her entirely.
"
393,401,0345447840,1.368421052631579,The Surgeon,TESS GERRITSEN,2002,Ballantine Books,http://images.amazon.com/images/P/0345447840.01.THUMBZZZ.jpg,http://images.amazon.com/images/P/0345447840.01.MZZZZZZZ.jpg,http://images.amazon.com/images/P/0345447840.01.LZZZZZZZ.jpg,"
A serial killer is on the loose in Boston. The victims are killed in a particularly nasty way, the killer obviously has medical knowledge and has been dubbed ""the Surgeon"" by the media. Detective Thomas Moore and his partner Rizzoli of the Boston Homicide Unit have discovered something that makes this case even more chilling. Years ago in Savannah a serial killer murdered in exactly the same way. He was finally stopped by his last victim who shot him as he tried to cut her. That last victim is Dr Catherine Cordell, who now works as a cardiac surgeon at one of Boston's prestigious hospitals. As the murders continue, it becomes obvious that the killer is drawing closer and closer to Dr Cordell who only person who can help the police catch this copycat killer. Or is it a copycat?
The Surgeon is a suspense novel by Tess Gerritsen, the first of the Maura Isles/Jane Rizzoli series.
"
394,402,0440201926,1.3653846153846154,Kaleidoscope,Danielle Steel,1988,Dell,http://images.amazon.com/images/P/0440201926.01.THUMBZZZ.jpg,http://images.amazon.com/images/P/0440201926.01.MZZZZZZZ.jpg,http://images.amazon.com/images/P/0440201926.01.LZZZZZZZ.jpg,"
From the author of 'Changes', this is a novel which tells the story of three sisters, separated during the war, and their search for each other.
Kaleidoscope is a 1987 novel by American Danielle Steel, published by Delacorte Press. It was adapted into the NBC television movie of the same name in 1990 starring Jaclyn Smith and Perry King. It is Steel's 22nd novel.
"
395,403,0671758896,1.3582089552238803,"Loves Music, Loves to Dance",Mary Higgins Clark,1992,Pocket,http://images.amazon.com/images/P/0671758896.01.THUMBZZZ.jpg,http://images.amazon.com/images/P/0671758896.01.MZZZZZZZ.jpg,http://images.amazon.com/images/P/0671758896.01.LZZZZZZZ.jpg,"
New York's trendy magazines are a source of peril when a killer enacts a bizarre dance of death, using the personal ads to lure his victims ... After college, best friends Erin Kelley and Darcy Scott move to the city to pursue exciting careers; Erin is a promising jewelry designer, Darcy finds success as a decorator. On a lark, Darcy persuades Erin to help their TV producer friend research the kinds of people who place personal ads. It seems like innocent fun ... until Erin disappears. Erin's body is found on an abandoned Manhattan pier -- on one foot is her own shoe, on the other, a high-heeled dancing slipper. Soon after, startling communiques from the killer reveal that Erin is not the first victim of this ""dancing shoe murderer."" And, if the killer has his way, she won't be his last. Next on his death list is Darcy
Loves Music, Loves to Dance is a novel by Mary Higgins Clark. It was one of Publishers Weekly's top 10 bestselling novels of 1991. The novel was adapted into a film in 2001.
"
