,Unnamed: 0,ISBN,Book-Rating,Book-Title,Book-Author,Year-Of-Publication,Publisher,Image-URL-S,Image-URL-M,Image-URL-L,Content
234,238,0440214041,1.885321100917431,The Pelican Brief,John Grisham,1993,Dell,http://images.amazon.com/images/P/0440214041.01.THUMBZZZ.jpg,http://images.amazon.com/images/P/0440214041.01.MZZZZZZZ.jpg,http://images.amazon.com/images/P/0440214041.01.LZZZZZZZ.jpg,"
Two Supreme Court Justices are dead. Their murders remain unsolved.
Darby Shaw, a brilliant and beautiful New Orleans legal student, draws up a speculative legal brief which links the deaths and uncovers an astonishing presidential conspiracy.
When her boyfriend is atomised in a car bomb, it becomes clear that somebody is intent on silencing Darby for good. Somebody who will stop at nothing to preserve the secrets of the Pelican Brief...
'Fast and furious' Daily Telegraph
'A rattling good story' New York Times
'I would highly recommend it ... a real page-turner' Frederick Forsyth, Sunday Express
The Pelican Brief is a legal-suspense thriller by John Grisham, published in 1992 by Doubleday. It is his third novel after A Time to Kill and The Firm. Two paperback editions were published, both by Dell Publishing in 1993. A namesake film adaptation was released in 1993 starring Julia Roberts and Denzel Washington.
"
235,239,0425178579,1.8852459016393444,Betrayal in Death,Nora Roberts,2001,Berkley Publishing Group,http://images.amazon.com/images/P/0425178579.01.THUMBZZZ.jpg,http://images.amazon.com/images/P/0425178579.01.MZZZZZZZ.jpg,http://images.amazon.com/images/P/0425178579.01.LZZZZZZZ.jpg,"However the act of murder was committed, in cold blood or hot, Eve Dallas was sworn to pursue it to its root. And serve the dead.' At the luxurious Roarke Palace Hotel, a maid walks into suite 4602 for the nightly turndown - and steps into her worst nightmare. A killer leaves her dead, strangled by a thin, silver wire. He's Sly Yost, a virtuoso of music and murder; a hit man for the elite. Lieutenant Eve Dallas knows him well. But in this twisted case, knowing the killer doesn't help solve the crime. Because there's someone else involved. Someone with a very personal motive. And Eve must face a terrifying possibility that the real target may, in fact, be her husband, Roarke.
"
236,240,0373484224,1.8846153846153848,Stanislaski Brothers (Silhouette Promo),Nora Roberts,2000,Silhouette,http://images.amazon.com/images/P/0373484224.01.THUMBZZZ.jpg,http://images.amazon.com/images/P/0373484224.01.MZZZZZZZ.jpg,http://images.amazon.com/images/P/0373484224.01.LZZZZZZZ.jpg,"Roberts delivers a special collection with two complete novels about the tempestuous and tantalizing Stanislaski brothers. Mikhail's rare talents attract a wealthy and classy beauty in ""Luring a Lady"". In ""Convincing Alex"", Alex mistakenly arrests a headstrong woman who decides the sexy detective is perfect for her research on cops. Satellite media tour.
"
237,241,0446609404,1.884057971014493,Cradle and All,James Patterson,2001,Warner Vision,http://images.amazon.com/images/P/0446609404.01.THUMBZZZ.jpg,http://images.amazon.com/images/P/0446609404.01.MZZZZZZZ.jpg,http://images.amazon.com/images/P/0446609404.01.LZZZZZZZ.jpg,"In Boston, a young woman finds herself pregnant – even though she is still a virgin.

In Ireland, another young woman discovers she is in the same impossible condition.

And in cities all around the world, medical authorities are overwhelmed by epidemics, droughts, famines, floods and worse. It all feels like a sign that something awful is coming.

Anne Fitzgerald, a former nun turned private investigator, is hired by the Archdiocese of Boston to investigate the immaculate conceptions. Even as she comes to care about and trust the young women, she realises that both are in great danger. Terrifying forces of light and darkness are gathering.

Stepping into uncharted territory where the unknown is just the beginning, Anne must discover the truth – to save the young women, to save herself and to protect the future of all mankind.

The worldwide bestseller, updated for young adults
"
238,242,0425189031,1.88,Portrait in Death,Nora Roberts,2003,Berkley Publishing Group,http://images.amazon.com/images/P/0425189031.01.THUMBZZZ.jpg,http://images.amazon.com/images/P/0425189031.01.MZZZZZZZ.jpg,http://images.amazon.com/images/P/0425189031.01.LZZZZZZZ.jpg,"
Her face was young and pretty, lips and cheeks rosy. 'She's dead isn't she? In this picture, she's already dead'

New York's top reporter is sent a glamorous portfolio - a beautiful girl in the prime of her life. But the camera lies. A closer look shows the girl's lifeless body held up by wires and clever lighting: immortalised and horrifying.

As the killer plucks more young people from their lives, Lieutenant Eve Dallas tries desperately to find a link. Trusting her instincts and her billionaire husband's shady past, Eve confronts the mounting panic.

But when a killer is consumed by a passionate madness, time is short . . .

'Truly fine entertainment', Publishers Weekly

Book Sixteen in the New York Times number one bestselling series
Portrait in Death is a novel by J. D. Robb. It is the sixteenth novel in the In Death series.
"
239,243,051512317X,1.8771929824561404,Rising Tides,Nora Roberts,2001,Jove Books,http://images.amazon.com/images/P/051512317X.01.THUMBZZZ.jpg,http://images.amazon.com/images/P/051512317X.01.MZZZZZZZ.jpg,http://images.amazon.com/images/P/051512317X.01.LZZZZZZZ.jpg,"The second novel in #1 New York Times bestselling author Nora Roberts' stunning Chesapeake Bay Saga, where the Quinn brothers must return to their family home on the Maryland shore, to honor their father's last request...

Ethan Quinn is a waterman. He wasn’t born to the tradition but has embraced it. He’s a quiet man whose heart runs as deep as the waters he loves. And now, with his father gone, Ethan is determined to make the family boatbuilding business a success. But amidst his achievements lie the most important challenges of his life…
 
There’s a young boy who needs him, and a woman and child he loves but never believed he could have. To shape his life around them, Ethan must face his own dark past—and accept not only who he is but what he hopes to become.

Don't miss the other books in the Chesapeake Bay Saga
Sea Swept
Inner Harbor
Chesapeake Blue 
"
240,244,0553279378,1.8767123287671232,I Know Why the Caged Bird Sings,MAYA ANGELOU,1983,Bantam,http://images.amazon.com/images/P/0553279378.01.THUMBZZZ.jpg,http://images.amazon.com/images/P/0553279378.01.MZZZZZZZ.jpg,http://images.amazon.com/images/P/0553279378.01.LZZZZZZZ.jpg,"
Here is a book as joyous and painful, as mysterious and memorable, as childhood itself. I Know Why the Caged Bird Sings captures the longing of lonely children, the brute insult of bigotry, and the wonder of words that can make the world right. Maya Angelou’s debut memoir is a modern American classic beloved worldwide.
 
Sent by their mother to live with their devout, self-sufficient grandmother in a small Southern town, Maya and her brother, Bailey, endure the ache of abandonment and the prejudice of the local “powhitetrash.” At eight years old and back at her mother’s side in St. Louis, Maya is attacked by a man many times her age—and has to live with the consequences for a lifetime. Years later, in San Francisco, Maya learns that love for herself, the kindness of others, her own strong spirit, and the ideas of great authors (“I met and fell in love with William Shakespeare”) will allow her to be free instead of imprisoned.
 
Poetic and powerful, I Know Why the Caged Bird Sings will touch hearts and change minds for as long as people read.

“I Know Why the Caged Bird Sings liberates the reader into life simply because Maya Angelou confronts her own life with such a moving wonder, such a luminous dignity.”—James Baldwin
I Know Why the Caged Bird Sings is a 1969 autobiography describing the young and early years of American writer and poet Maya Angelou. The first in a seven-volume series, it is a coming-of-age story that illustrates how strength of character and a love of literature can help overcome racism and trauma.
"
241,245,0671042262,1.8679245283018868,The Blue Nowhere : A Novel,Jeffery Deaver,2002,Pocket,http://images.amazon.com/images/P/0671042262.01.THUMBZZZ.jpg,http://images.amazon.com/images/P/0671042262.01.MZZZZZZZ.jpg,http://images.amazon.com/images/P/0671042262.01.LZZZZZZZ.jpg,"
Jeffery Deaver, New York Times bestselling author of The Skin Collector and The Bone Collector featuring popular forensic detective Lincoln Rhyme, delivers a masterful thriller about a psychotic computer hacker/killer packed with stunning and fact-based technical details and signature Deaver plot twists.

People in Silicon Valley are dying. A mysterious, psychotic, and brilliant computer hacker, code-named Phate, is infiltrating their computer, invading their lives, and—with the perfect line, the perfect, personal detail—luring them to their deaths.

Desperate, the head of the Computer Crimes Division frees Wyatt Gillette, imprisoned on his own hacking charge, to aid the investigation. Gillette has wrangled with Phate before and is glad to have his chance for revenge. But when the head of the CCD, and the man who hired him, is murdered, Wyatt must report to Frank Bristol, a grizzled homicide detective who favors old-fashioned sleuthing and forensic evidence to track killers. Together, Wyatt and Bristol make an unlikely team but with the same villain in their crosshairs, they’ll have to learn to get over the generational, and technological, gaps.

Filled with accurate technical details, a “high-tension wired” (People) mystery, and shocking surprises, The Blue Nowhere will keep you guessing the outcome to the very last page.
"
242,246,068484477X,1.8671875,STONES FROM THE RIVER,Ursula Hegi,1997,Touchstone,http://images.amazon.com/images/P/068484477X.01.THUMBZZZ.jpg,http://images.amazon.com/images/P/068484477X.01.MZZZZZZZ.jpg,http://images.amazon.com/images/P/068484477X.01.LZZZZZZZ.jpg,"
""Stones from the River"" is a daring, dramatic and complex novel of life in Germany. It is set in Burgdorf, a small fictional German town, between 1915 and 1951. The protagonist is Trudi Montag, a Zwerg -- the German word for dwarf woman. As a dwarf she is set apart, the outsider whose physical ""otherness"" has a corollary in her refusal to be a part of Burgdorf's silent complicity during and after World War II. Trudi establishes her status and power, not through beauty, marriage, or motherhood, but rather as the town's librarian and relentless collector of stories.
Through Trudi's unblinking eyes, we witness the growing impact of Nazism on the ordinary townsfolk of Burgdorf as they are thrust on to a larger moral stage and forced to make choices that will forever mark their lives. ""Stones from the River"" is a story of secrets, parceled out masterfully by Trudi -- and by Ursula Hegi -- as they reveal the truth about living through unspeakable times.
Stones from the River is the third-person omniscient 1994 novel by Ursula Hegi which chronicles 40 years of the life of Trudi, a woman with dwarfism, as she navigates the silently complicit, violent, and redemptive era of World War I and II Germany in the fictional town of Burgdorf.
"
243,247,0446608955,1.8613861386138617,A Walk to Remember,Nicholas Sparks,2000,Warner Books,http://images.amazon.com/images/P/0446608955.01.THUMBZZZ.jpg,http://images.amazon.com/images/P/0446608955.01.MZZZZZZZ.jpg,http://images.amazon.com/images/P/0446608955.01.LZZZZZZZ.jpg,"
NOVEL LEARNING SERIES(TM)

A WALK TO REMEMBER by Nicholas Sparks

STUDENT EDITION

""When I was seventeen, my life changed forever . . . "" So begins Nicholas Sparks's touching tale of Landon Carter, a teenage boy living in the small town of Beaufort, North Carolina in the late 1950s. Landon is a typical teenager who just wants to have a fun senior year before heading off to college. The last thing he anticipated is Jamie Sullivan, the sweet, pious daughter of the town's Baptist minister.

But on the evening of Beaufort's annual Christmas pageant, Landon will undergo a change of heart that will forever alter the course of his life. In the months that follow, Landon discovers truths that it takes most people a lifetime to learn-truths about the nature of beauty, the joy of giving, the pain of loss, and, most of all, the transformational power of love.


With a NOVEL LEARNING SERIES(TM) Student Guide

· Questions about the text after every few chapters check your comprehension

· Quizzes throughout help you prepare for standardized tests with SAT- and ACT-style questions using vocabulary and grammar from the book

· Sample writing prompts and essays at the end guide you through the elements of an above-average, average, and below-average essay-and explain why!
A Walk to Remember is a novel by American writer Nicholas Sparks, released in October 1999. The novel, set in 1958–1959 in Beaufort, North Carolina, is a story of two teenagers who fall in love with each other despite the disparity of their personalities. A Walk to Remember is adapted in the film of the same name.
"
244,248,0345465083,1.859375,Seabiscuit,LAURA HILLENBRAND,2003,Ballantine Books,http://images.amazon.com/images/P/0345465083.01.THUMBZZZ.jpg,http://images.amazon.com/images/P/0345465083.01.MZZZZZZZ.jpg,http://images.amazon.com/images/P/0345465083.01.LZZZZZZZ.jpg,"
The true story of three men and their dreams for a racehorse - Seabiscuit - that symbolized a pivotal moment in American history as modern America was born out of the crucible of the Depression and the dustbowl, as the 20th century's greatest nation found the courage to bet on itself to win against the odds. In 1936 the habits of 19th-century America were finally consigned to history just as Margaret Mitchell's Gone with the Wind was published. In their place, modern America was born. But what defined this new era? Nothing more than the story of Seabiscuit, a stunted colt with asymmetrical knees that had for two years been hacked around no-good race tracks which led to permanent leg damage. Yet by 1937 Seabiscuit could draw crowds of 60,000 and had more newspaper column inches devoted to him than Mussolini, Hitler or Roosevelt, his popularity peaking during his appearances at the Santa Anita Handicap. America had gone to the races for the first time since the Depression and fallen in love with a misshapen colt of great character. Now it wanted a winner.
Seabiscuit: An American Legend is a non-fiction book written by Laura Hillenbrand, published in 1999. The book is a biography of the Thoroughbred racehorse Seabiscuit. It won the William Hill Sports Book of the Year and was adapted as a feature film in 2003.
"
245,249,0804106304,1.8488372093023255,The Joy Luck Club,Amy Tan,1994,Prentice Hall (K-12),http://images.amazon.com/images/P/0804106304.01.THUMBZZZ.jpg,http://images.amazon.com/images/P/0804106304.01.MZZZZZZZ.jpg,http://images.amazon.com/images/P/0804106304.01.LZZZZZZZ.jpg,"
Discover Amy Tan's moving and poignant tale of immigrant Chinese mothers and their American-born daughters.

'The Joy Luck Club is an ambitious saga that's impossible to read without wanting to call your Mum' Stylist

In 1949 four Chinese women, recent immigrants to San Francisco, meet weekly to play mahjong and tell stories of what they left behind in China. United in loss and new hope for their daughters' futures, they call themselves the Joy Luck Club.

Their daughters, who have never heard these stories, think their mothers' advice is irrelevant to their modern American lives - until their own inner crises reveal how much they've unknowingly inherited of their mothers' pasts.

'Pure enchantment' Mail on Sunday
The Joy Luck Club is a 1989 novel written by Amy Tan. It focuses on four Chinese immigrant families in San Francisco who start a club known as The Joy Luck Club, playing the Chinese game of mahjong for money while feasting on a variety of foods.
"
246,250,051511992X,1.8461538461538465,That Camden Summer,Lavyrle Spencer,1997,Jove Books,http://images.amazon.com/images/P/051511992X.01.THUMBZZZ.jpg,http://images.amazon.com/images/P/051511992X.01.MZZZZZZZ.jpg,http://images.amazon.com/images/P/051511992X.01.LZZZZZZZ.jpg,"
LaVyrle Spencer, known for her “heartrending slices of Americana”* writes of how love can be more special the second time around in this New York Times bestseller.

It is 1916 and Roberta Jewett is surprised to find that her hometown of Camden, Maine, considers a divorced woman little more than a prostitute. Condemned by her mother and scorned by neighbors, she nonetheless perseveres in her struggle to forge a good life for her girls and herself. Behaving like no “respectable” woman would, she gets a job as a county nurse, learns to drive, and buys her very own Model T.

Embittered by her painful marriage to an unfaithful husband, she has no intention of being any man's victim again. So Roberta is taken aback to find the widowed carpenter Gabriel Farley has somehow found his way into her heart. And in the ultimate test of will and devotion, she must depend on the man she has grown to love—and summon the courage to stand up to an entire town.

“[LaVyrle Spencer] knows how to tug at readers’ heartstrings.”—*Publishers Weekly 
"
247,251,055356451X,1.84,Night Sins,TAMI HOAG,1995,Bantam,http://images.amazon.com/images/P/055356451X.01.THUMBZZZ.jpg,http://images.amazon.com/images/P/055356451X.01.MZZZZZZZ.jpg,http://images.amazon.com/images/P/055356451X.01.LZZZZZZZ.jpg,"The first suspense mystery in the Deer Lake series from Sunday Times bestselling author Tami Hoag.

Deer Lake is a small Minnesota town where people know their neighbours and crime is something that happens on the evening news. But the illusion of safety is shattered when eight-year-old Josh Kirkwood disappears. All the police find is his duffel bag with a note stuffed inside, 'Ignorance is not innocence but SIN'.

With each passing hour the search for Josh takes on a more ominous intensity. For Megan O'Malley, the new regional officer of the state criminal investigative unit, it is a test of whether she can cut it in the all-male world of local cops. And for police chief Mitch Holt, it is a frightening reminder of the big city crime that devastated his life before he fled to Deer Lake ...
"
248,252,0425169863,1.837209302325581,Point of Origin,Patricia Daniels Cornwell,1999,Berkley Publishing Group,http://images.amazon.com/images/P/0425169863.01.THUMBZZZ.jpg,http://images.amazon.com/images/P/0425169863.01.MZZZZZZZ.jpg,http://images.amazon.com/images/P/0425169863.01.LZZZZZZZ.jpg,"
The clues to a series of remorseless killings go up in smoke—and only Kay Scarpetta can find them in this #1 New York Times bestseller from Patricia Cornwell.

“Sears its way into the psyche…Ablaze with Cornwell’s finest, scariest writing.”—Atlanta Journal Constitution

The devastating fire tore through the horse farm, destroying everything it touched. Picking through the wreckage, Dr. Kay Scarpetta uncovers human remains—the work of an audacious and wily killer who uses fire to mask his brutal murders. And when Scarpetta learns that her old nemesis, Carrie Grethen, has escaped from a hospital for the criminally insane and is somehow involved, the investigation becomes personal. Tragedy strikes close to home. And Scarpetta must match Grethen’s every move with one of her own to douse the inferno of evil that threatens everyone around her...

Includes an Introduction by the Author
Point of Origin is a crime fiction novel by Patricia Cornwell. It is the ninth book in the Dr. Kay Scarpetta series.
"
249,253,0425144429,1.836065573770492,Mr. Murder,Dean R. Koontz,1996,Berkley Publishing Group,http://images.amazon.com/images/P/0425144429.01.THUMBZZZ.jpg,http://images.amazon.com/images/P/0425144429.01.MZZZZZZZ.jpg,http://images.amazon.com/images/P/0425144429.01.LZZZZZZZ.jpg,"
#1 New York Times bestselling author Dean Koontz delivers a gripping novel of a man accused of stealing not just someone’s identity, but his entire life...

A big house. A beautiful wife. Two happy and healthy children. It’s a nice life that writer Martin Stillwater has made for himself. But he can’t shake this feeling of impending disaster.

One bad moment on an otherwise fine day has put Marty on a collision course with a killer—a man with a mere shadow of an identity who is desperately searching for something more...

Martin’s home. Martin’s family. Martin’s life.
Mr. Murder is a horror novel by the best-selling author Dean Koontz, released in 1993.
"
250,254,0446610399,1.8356164383561644,The Rescue,Nicholas Sparks,2001,Warner Books,http://images.amazon.com/images/P/0446610399.01.THUMBZZZ.jpg,http://images.amazon.com/images/P/0446610399.01.MZZZZZZZ.jpg,http://images.amazon.com/images/P/0446610399.01.LZZZZZZZ.jpg,"
How do you learn to trust again? Denise Hilton, a young single mother, is driving through Edenton, North Carolina, when her car skids off the road during a storm. With her is her four-year-old son, Kyle, a boy with severe learning disabilities for whom she has sacrificed everything. When volunteer fireman Taylor McAden finds her she is unconscious and bleeding, but when she wakes an even more chilling truth becomes clear: Kyle is gone. When confronted by raging fires or deadly accidents, Taylor feels compelled to take terrifying risks to save lives, and the search for Kyle is no exception. But there is one leap of faith Taylor cannot bring himself to make - to commit to a relationship. Will this chance meeting with Denise prove any different?
The Rescue is a novel written by the American author Nicholas Sparks, first published in 2000. It debuted at number 2 on the New York Times Best Sellers list on October 8, 2000, and reached number 1 the following week. Sparks's son, Ryan, was the inspiration for the book.
"
251,255,0375703055,1.8333333333333333,Ellen Foster,Kaye Gibbons,1997,Vintage Books,http://images.amazon.com/images/P/0375703055.01.THUMBZZZ.jpg,http://images.amazon.com/images/P/0375703055.01.MZZZZZZZ.jpg,http://images.amazon.com/images/P/0375703055.01.LZZZZZZZ.jpg,"
""Filled with lively humor, compassion, and intimacy.""
—Alice Hoffman, The New York Times Book Review

""When I was little I would think of ways to kill my daddy."" With that opening sentence we enter the childhood world of one of the most appealing young heroines in contemporary fiction. Her courage, her humor, and her wisdom are unforgettable as she tells her own story with stunning honesty and insight. An Oprah Book Club selection, this powerful novel has become an American classic.

Winner of the American Academy of Arts and Letters' Sue Kaufman Prize for First Fiction and the Ernest Hemingway Foundation's Citation for Fiction. 
Ellen Foster is a 1987 novel by American novelist Kaye Gibbons. It was a selection of Oprah's Book Club in October 1997.
"
252,256,0553279912,1.8285714285714283,A Is for Alibi (Kinsey Millhone Mysteries (Paperback)),SUE GRAFTON,1987,Bantam,http://images.amazon.com/images/P/0553279912.01.THUMBZZZ.jpg,http://images.amazon.com/images/P/0553279912.01.MZZZZZZZ.jpg,http://images.amazon.com/images/P/0553279912.01.LZZZZZZZ.jpg,"
A is for Alibi is the first in the Kinsey Millhone mystery series by Sue Grafton.

My name is Kinsey Millhone. I’m a private investigator, licensed by the state of California. I’m thirty-two years old, twice divorced, no kids. The day before yesterday I killed someone and the fact weighs heavily on my mind . . .

When Laurence Fife was murdered, few cared. A slick divorce attorney with a reputation for ruthlessness, Fife was also rumoured to be a slippery ladies’ man. Plenty of people in the picturesque Southern California town of Santa Teresa had reason to want him dead. Including, thought the cops, his young and beautiful wife, Nikki. With motive, access and opportunity, Nikki was their number one suspect. The Jury thought so too.

Eight years later and out on parole, Nikki Fife hires Kinsey Millhone to find out who really killed her husband. But the trail has gone cold and there is a chilling twist even Kinsey didn’t expect . . .

Continue the Alphabet series with another gripping investigation in B is for Burglar.
""A"" Is for Alibi is the first mystery novel in Sue Grafton's ""Alphabet"" series, and was published by Holt, Rinehart and Winston in 1982. Featuring sleuth Kinsey Millhone, it is set in the southern California city of Santa Teresa, the nom de plume for Santa Barbara.
"
253,257,0345378482,1.8269230769230769,The Andromeda Strain,MICHAEL CRICHTON,1992,Ballantine Books,http://images.amazon.com/images/P/0345378482.01.THUMBZZZ.jpg,http://images.amazon.com/images/P/0345378482.01.MZZZZZZZ.jpg,http://images.amazon.com/images/P/0345378482.01.LZZZZZZZ.jpg,"
From the author of Jurassic Park, Timeline, and Sphere comes a captivating thriller about a deadly extraterrestrial microorganism, which threatens to annihilate human life.
 
Five prominent biophysicists have warned the United States government that sterilization procedures for returning space probes may be inadequate to guarantee uncontaminated re-entry to the atmosphere. Two years later, a probe satellite falls to the earth and lands in a desolate region of northeastern Arizona. Nearby, in the town of Piedmont, bodies lie heaped and flung across the ground, faces locked in frozen surprise. What could cause such shock and fear? The terror has begun, and there is no telling where it will end. 
The Andromeda Strain is a 1969 novel by Michael Crichton, his first novel under his own name and his sixth novel overall. It documents the outbreak of a deadly extraterrestrial microorganism in Arizona and the team of scientists investigating it.
"
