,Unnamed: 0,ISBN,Book-Rating,Book-Title,Book-Author,Year-Of-Publication,Publisher,Image-URL-S,Image-URL-M,Image-URL-L,Content
0,0,0439064864,5.596774193548387,Harry Potter and the Chamber of Secrets (Book 2),J. K. Rowling,1999,Scholastic,http://images.amazon.com/images/P/0439064864.01.THUMBZZZ.jpg,http://images.amazon.com/images/P/0439064864.01.MZZZZZZZ.jpg,http://images.amazon.com/images/P/0439064864.01.LZZZZZZZ.jpg,"
Harry can't wait for his holidays with the dire Dursleys to end. But a small, self-punishing house-elf warns Harry of mortal danger awaiting him at Hogwarts School. Returning to the castle nevertheless, Harry hears a rumour about a chamber of secrets, holding unknown horrors to wizards of Muggle parentage. Now someone is casting spells that turn people to stone, and a terrible warning is found painted on the wall. The chief suspect - always in the wrong place - is Harry. But something much darker has yet to be unleashed.
Harry Potter and the Chamber of Secrets is a fantasy novel written by British author J. K. Rowling and the second novel in the Harry Potter series.
"
1,1,0439136350,5.426470588235294,Harry Potter and the Prisoner of Azkaban (Book 3),J. K. Rowling,1999,Scholastic,http://images.amazon.com/images/P/0439136350.01.THUMBZZZ.jpg,http://images.amazon.com/images/P/0439136350.01.MZZZZZZZ.jpg,http://images.amazon.com/images/P/0439136350.01.LZZZZZZZ.jpg,"
For twelve long years, the dread fortress of Azkaban held an infamous prisoner named Sirius Black. Convicted of killing thirteen people with a single curse, he was said to be the heir apparent to the Dark Lord, Voldemort.
Now he has escaped, leaving only two clues as to where he might be headed: Harry Potter's defeat of You-Know-Who was Black's downfall as well. And the Azkaban guards heard Black muttering in his sleep, ""He's at Hogwarts... he's at Hogwarts.""
Harry Potter isn't safe, not even within the walls of his magical school, surrounded by his friends. Because on top of it all, there may be a traitor in their midst.
Harry Potter and the Prisoner of Azkaban is a fantasy novel written by British author J. K. Rowling and is the third in the Harry Potter series. The book follows Harry Potter, a young wizard, in his third year at Hogwarts School of Witchcraft and Wizardry.
"
2,2,0439139597,5.343283582089552,Harry Potter and the Goblet of Fire (Book 4),J. K. Rowling,2000,Scholastic,http://images.amazon.com/images/P/0439139597.01.THUMBZZZ.jpg,http://images.amazon.com/images/P/0439139597.01.MZZZZZZZ.jpg,http://images.amazon.com/images/P/0439139597.01.LZZZZZZZ.jpg,"
Fourteen-year-old Harry Potter joins the Weasleys at the Quidditch World Cup, then enters his fourth year at Hogwarts Academy where he is mysteriously entered in an unusual contest that challenges his wizarding skills, friendships and character, amid signs that an old enemy is growing stronger.
Harry Potter and the Goblet of Fire is a fantasy novel written by British author J. K. Rowling and the fourth novel in the Harry Potter series.
"
3,3,043935806X,4.262135922330097,Harry Potter and the Order of the Phoenix (Book 5),J. K. Rowling,2003,Scholastic,http://images.amazon.com/images/P/043935806X.01.THUMBZZZ.jpg,http://images.amazon.com/images/P/043935806X.01.MZZZZZZZ.jpg,http://images.amazon.com/images/P/043935806X.01.LZZZZZZZ.jpg,"
This special edition of Harry Potter and the Order of the Phoenix has a gorgeous new cover illustration by Kazu Kibuishi. Inside is the full text of the original novel, with decorations by Mary GrandPr .

There is a door at the end of a silent corridor. And it's haunting Harry Potter's dreams. Why else would he be waking in the middle of the night, screaming in terror?
Here are just a few things on Harry's mind:
A Defense Against the Dark Arts teacher with a personality like poisoned honeyA venomous, disgruntled house-elfRon as keeper of the Gryffindor Quidditch teamThe looming terror of the end-of-term Ordinary Wizarding Level exams
...and of course, the growing threat of He-Who-Must-Not-Be-Named. In the richest installment yet of J. K. Rowling's seven-part story, Harry Potter is faced with the unreliability of the very government of the magical world and the impotence of the authorities at Hogwarts.
Despite this (or perhaps because of it), he finds depth and strength in his friends, beyond what even he knew; boundless loyalty; and unbearable sacrifice.
Though thick runs the plot (as well as the spine), readers will race through these pages and leave Hogwarts, like Harry, wishing only for the next train back.
Harry Potter and the Order of the Phoenix is a fantasy novel written by British author J. K. Rowling and the fifth novel in the Harry Potter series.
"
4,4,0446310786,3.8633093525179856,To Kill a Mockingbird,Harper Lee,1988,Little Brown &amp; Company,http://images.amazon.com/images/P/0446310786.01.THUMBZZZ.jpg,http://images.amazon.com/images/P/0446310786.01.MZZZZZZZ.jpg,http://images.amazon.com/images/P/0446310786.01.LZZZZZZZ.jpg,"
Voted America's Best-Loved Novel in PBS's The Great American Read
Harper Lee's Pulitzer Prize-winning masterwork of honor and injustice in the deep South—and the heroism of one man in the face of blind and violent hatred
One of the most cherished stories of all time, To Kill a Mockingbird has been translated into more than forty languages, sold more than forty million copies worldwide, served as the basis for an enormously popular motion picture, and was voted one of the best novels of the twentieth century by librarians across the country. A gripping, heart-wrenching, and wholly remarkable tale of coming-of-age in a South poisoned by virulent prejudice, it views a world of great beauty and savage inequities through the eyes of a young girl, as her father—a crusading local lawyer—risks everything to defend a black man unjustly accused of a terrible crime.
To Kill a Mockingbird is a novel by the American author Harper Lee. It was published in 1960 and was instantly successful. In the United States, it is widely read in high schools and middle schools.
"
5,5,0440998050,3.854838709677419,A Wrinkle in Time,Madeleine L'Engle,1976,Laure Leaf,http://images.amazon.com/images/P/0440998050.01.THUMBZZZ.jpg,http://images.amazon.com/images/P/0440998050.01.MZZZZZZZ.jpg,http://images.amazon.com/images/P/0440998050.01.LZZZZZZZ.jpg,"
Madeleine L'Engle's ground-breaking science fiction and fantasy classic, now a major motion picture.

It was a dark and stormy night; Meg Murry, her small brother Charles Wallace, and her mother had come down to the kitchen for a midnight snack when they were upset by the arrival of a most disturbing stranger.

""Wild nights are my glory,"" the unearthly stranger told them. ""I just got caught in a downdraft and blown off course. Let me sit down for a moment, and then I'll be on my way. Speaking of ways, by the way, there is such a thing as a tesseract.""

A tesseract (in case the reader doesn't know) is a wrinkle in time. To tell more would rob the reader of the enjoyment of Miss L'Engle's unusual book. A Wrinkle in Time, winner of the Newbery Medal in 1963, is the story of the adventures in space and time of Meg, Charles Wallace, and Calvin O'Keefe (athlete, student, and one of the most popular boys in high school). They are in search of Meg's father, a scientist who disappeared while engaged in secret work for the government on the tesseract problem.

A Wrinkle in Time is the winner of the 1963 Newbery Medal. It is the first book in The Time Quintet, which consists of A Wrinkle in Time, A Wind in the Door, A Swiftly Tilting Planet, Many Waters, and An Acceptable Time.

A Wrinkle in Time is now a movie from Disney, directed by Ava DuVernay, starring Storm Reid, Oprah Winfrey, Reese Witherspoon and Mindy Kaling.

This title has Common Core connections.

Books by Madeleine L'Engle

A Wrinkle in Time Quintet
A Wrinkle in Time
A Wind in the Door
A Swiftly Tilting Planet
Many Waters
An Acceptable Time

A Wrinkle in Time: The Graphic Novel by Madeleine L'Engle; adapted & illustrated by Hope Larson

Intergalactic P.S. 3 by Madeleine L'Engle; illustrated by Hope Larson: A standalone story set in the world of A Wrinkle in Time.

The Austin Family Chronicles
Meet the Austins (Volume 1)
The Moon by Night (Volume 2)
The Young Unicorns (Volume 3)
A Ring of Endless Light (Volume 4) A Newbery Honor book!
Troubling a Star (Volume 5)

The Polly O'Keefe books
The Arm of the Starfish
Dragons in the Waters
A House Like a Lotus

And Both Were Young

Camilla

The Joys of Love
A Wrinkle in Time is a young adult science fantasy novel written by American author Madeleine L'Engle. First published in 1962, the book won the Newbery Medal, the Sequoyah Book Award, the Lewis Carroll Shelf Award, and was runner-up for the Hans Christian Andersen Award.
"
6,6,0451524934,3.8461538461538463,1984,George Orwell,1990,Signet Book,http://images.amazon.com/images/P/0451524934.01.THUMBZZZ.jpg,http://images.amazon.com/images/P/0451524934.01.MZZZZZZZ.jpg,http://images.amazon.com/images/P/0451524934.01.LZZZZZZZ.jpg,"Nineteen Eighty-Four is a dystopian social science fiction novel and cautionary tale by English writer George Orwell. It was published on 8 June 1949 by Secker & Warburg as Orwell's ninth and final book completed in his lifetime.
"
7,7,0060392452,3.756410256410256,Stupid White Men ...and Other Sorry Excuses for the State of the Nation!,Michael Moore,2002,Regan Books,http://images.amazon.com/images/P/0060392452.01.THUMBZZZ.jpg,http://images.amazon.com/images/P/0060392452.01.MZZZZZZZ.jpg,http://images.amazon.com/images/P/0060392452.01.LZZZZZZZ.jpg,"
Tells you what you need to know about how the great and the good screw us over. This title reveals - among other things - how 'President' Bush stole an election aided only by his brother, cousin and dad's cronies, electoral fraud and tame judges; and how politicians have whored themselves to big business.
Stupid White Men ...and Other Sorry Excuses for the State of the Nation! is a book by American filmmaker Michael Moore published in 2001.
"
8,8,0553296981,3.7096774193548385,Anne Frank: The Diary of a Young Girl,ANNE FRANK,1993,Bantam,http://images.amazon.com/images/P/0553296981.01.THUMBZZZ.jpg,http://images.amazon.com/images/P/0553296981.01.MZZZZZZZ.jpg,http://images.amazon.com/images/P/0553296981.01.LZZZZZZZ.jpg,"
An Inspiration The Holocaust was one of the most horrendous and terrible eras in history. Innumerable books have been written describing the horrors of the Holocaust; but nothing beats the documentation of a family who had gone into hiding in the diary of a little girl, Anne Frank. Honest, lucid and empathetic; The Diary of A Young Girl deserves a read by everyone who has ever questioned mental strength of humans and also by those who cannot come to terms with the cruelties that could be inflicted by humans upon fellow humans. The first entry in the diary is on June 12, 1942 by Anne Frank, who had received it as a birthday present and the entries in the diary end abruptly on 1 August, 1944. The Underlying Themes Anne Frank and her family lived a peaceful life in Frankfurt, Germany but they had to escape to Amsterdam with fellow Jews and go into hiding, as the Nazis took over Europe.
The Diary of a Young Girl, often referred to as The Diary of Anne Frank, is a book of the writings from the Dutch-language diary kept by Anne Frank while she was in hiding for two years with her family during the Nazi occupation of the Netherlands.
"
9,9,0345350499,3.6885245901639343,The Mists of Avalon,MARION ZIMMER BRADLEY,1987,Del Rey,http://images.amazon.com/images/P/0345350499.01.THUMBZZZ.jpg,http://images.amazon.com/images/P/0345350499.01.MZZZZZZZ.jpg,http://images.amazon.com/images/P/0345350499.01.LZZZZZZZ.jpg,"Here is the tragic tale of the rise and fall of Camelot - but seen through the eyes of Camelot's women: The devout Gwenhwyfar, Arthur's Queen; Vivane, High priestess of Avalon and the Lady of the Lake; above all, Morgaine, possessor of the sight, the wise, the wise-woman fated to bring ruin on them all...
"
10,11,0064400557,3.672727272727273,Charlotte's Web (Trophy Newbery),E. B. White,1974,HarperTrophy,http://images.amazon.com/images/P/0064400557.01.THUMBZZZ.jpg,http://images.amazon.com/images/P/0064400557.01.MZZZZZZZ.jpg,http://images.amazon.com/images/P/0064400557.01.LZZZZZZZ.jpg,"
Don’t miss one of America’s top 100 most-loved novels, selected by PBS’s The Great American Read.
This beloved book by E. B. White, author of Stuart Little and The Trumpet of the Swan, is a classic of children's literature that is ""just about perfect."" Illustrations in this ebook appear in vibrant full color on a full-color device and in rich black-and-white on all other devices.
Some Pig. Humble. Radiant. These are the words in Charlotte's Web, high up in Zuckerman's barn. Charlotte's spiderweb tells of her feelings for a little pig named Wilbur, who simply wants a friend. They also express the love of a girl named Fern, who saved Wilbur's life when he was born the runt of his litter.
E. B. White's Newbery Honor Book is a tender novel of friendship, love, life, and death that will continue to be enjoyed by generations to come. It contains illustrations by Garth Williams, the acclaimed illustrator of E. B. White's Stuart Little and Laura Ingalls Wilder's Little House series, among many other books.
Whether enjoyed in the classroom or for homeschooling or independent reading, Charlotte's Web is a proven favorite.
Charlotte's Web is a book of children's literature by American author E. B. White and illustrated by Garth Williams; it was published on October 15, 1952, by Harper & Brothers. The novel tells the story of a livestock pig named Wilbur and his friendship with a barn spider named Charlotte.
"
11,12,0446532231,3.6545454545454543,"Dude, Where's My Country?",Michael Moore,2003,Warner Books,http://images.amazon.com/images/P/0446532231.01.THUMBZZZ.jpg,http://images.amazon.com/images/P/0446532231.01.MZZZZZZZ.jpg,http://images.amazon.com/images/P/0446532231.01.LZZZZZZZ.jpg,"
He's the man everyone's talking about. He's taken on gun freaks, stupid white men and corporate crooks. Now Michael Moore is on a new mission: to get us of our behinds and kicking out the corrupt political elites who rule our lives.
Dude, Where's My Country? is a 2003 book by Michael Moore dealing with corporate and political events in the United States. The title is a satirical reworking of the 2000 film Dude, Where's My Car?. The book covers many topics and is written in a heavily satirical fashion, in common with much of Moore's work.
"
12,13,0345445848,3.588235294117647,Big Cherry Holler: A Big Stone Gap Novel (Ballantine Reader's Circle),Adriana Trigiani,2002,Ballantine Books,http://images.amazon.com/images/P/0345445848.01.THUMBZZZ.jpg,http://images.amazon.com/images/P/0345445848.01.MZZZZZZZ.jpg,http://images.amazon.com/images/P/0345445848.01.LZZZZZZZ.jpg,"It's 1978, and Ave Maria Mulligan is the thirty-five-year-old self-proclaimed spinster of Big Stone Gap, a sleepy hamlet in the Blue Ridge Mountains of Virginia. She's also the local pharmacist, the co-captain of the Rescue Squad, and the director of The
"
13,14,0440215625,3.568965517241379,Dragonfly in Amber,DIANA GABALDON,1993,Dell,http://images.amazon.com/images/P/0440215625.01.THUMBZZZ.jpg,http://images.amazon.com/images/P/0440215625.01.MZZZZZZZ.jpg,http://images.amazon.com/images/P/0440215625.01.LZZZZZZZ.jpg,"
NOW THE STARZ ORIGINAL SERIES OUTLANDER

With her classic novel Outlander, Diana Gabaldon introduced two unforgettable characters--Claire Randall and Jamie Fraser--delighting readers with a story of adventure and love that spanned two centuries. Now Gabaldon returns to that extraordinary time and place in this vivid, powerful sequel to Outlander.
DRAGONFLY IN AMBER

For twenty years, Claire Randall has kept her secrets. But now she is returning with her grown daughter to the mysteries of Scotland's mist-shrouded Highlands.
Here Claire plans to reveal a truth as shocking as the events that gave it birth: the secret of an ancient circle of standing stones, the secret of a love that transcends centuries, and the truth of a man named Jamie Fraser--a Highland warrior whose gallantry once drew the young Claire from the security of her century to the dangers of his.
Claire's spellbinding journey continues through the intrigue-ridden French court and the menace of Jacobite plots, to the Highlands of Scotland, through war and death in a desperate fight to save both the child and the man she loves.
Praise for Dragonfly in Amber
""Diana Gabaldon is a born storyteller. . . . The pages practically turn themselves.""--The Arizona Republic
""A triumph A powerful tale layered in history and myth. I loved every page.""--Nora Roberts
""Compulsively readable.""--Publishers Weekly
Dragonfly in Amber is the second book in the Outlander series of novels by Diana Gabaldon. Centered on time travelling 20th century nurse Claire Randall and her 18th century Scottish Highlander warrior husband Jamie Fraser, the books contain elements of historical fiction, romance, adventure and fantasy.
"
14,16,0312990456,3.5555555555555554,One for the Money (A Stephanie Plum Novel),Janet Evanovich,2003,St. Martin's Paperbacks,http://images.amazon.com/images/P/0312990456.01.THUMBZZZ.jpg,http://images.amazon.com/images/P/0312990456.01.MZZZZZZZ.jpg,http://images.amazon.com/images/P/0312990456.01.LZZZZZZZ.jpg,"
Stephanie Plum is down on her luck. She's lost her job at New Jersey's most down-market lingerie store, her car's on the brink of repossession, and her apartment is fast becoming furniture-free. Enter Cousin Vinnie, a low-life who runs a bail-bond company. If Stephanie can bring in vice cop turned outlaw Joe Morelli, she stands to pick up $10,000. But tracking down a cop wanted for murder isn't easy. And suddenly Stephanie has another problem on her hands. Benito Ramirez, a prize-fighter with more menace than mentality, wants her to be his friend - and he won't take no for an answer. Soon Stephanie begins to know exactly what it feels like to be pursued - and the best person to protect her just happens to be on the run...
'One of the funniest and most enjoyable books I have read for a long time.'
Sunday Telegraph
One for the Money is the first novel by Janet Evanovich featuring the bounty hunter Stephanie Plum. It was published in 1994 in the United States and in 1995 in Great Britain.
"
15,17,0440180295,3.54,Slaughterhouse Five or the Children's Crusade: A Duty Dance With Death,Kurt Vonnegut,1991,Laurel,http://images.amazon.com/images/P/0440180295.01.THUMBZZZ.jpg,http://images.amazon.com/images/P/0440180295.01.MZZZZZZZ.jpg,http://images.amazon.com/images/P/0440180295.01.LZZZZZZZ.jpg,"
Kurt Vonnegut’s masterpiece, Slaughterhouse-Five is “a desperate, painfully honest attempt to confront the monstrous crimes of the twentieth century” (Time).
 
Selected by the Modern Library as one of the 100 best novels of all time
 
Slaughterhouse-Five, an American classic, is one of the world’s great antiwar books. Centering on the infamous World War II firebombing of Dresden, the novel is the result of what Kurt Vonnegut described as a twenty-three-year struggle to write a book about what he had witnessed as an American prisoner of war. It combines historical fiction, science fiction, autobiography, and satire in an account of the life of Billy Pilgrim, a barber’s son turned draftee turned optometrist turned alien abductee. As Vonnegut had, Billy experiences the destruction of Dresden as a POW. Unlike Vonnegut, he experiences time travel, or coming “unstuck in time.”

An instant bestseller, Slaughterhouse-Five made Kurt Vonnegut a cult hero in American literature, a reputation that only strengthened over time, despite his being banned and censored by some libraries and schools for content and language. But it was precisely those elements of Vonnegut’s writing—the political edginess, the genre-bending inventiveness, the frank violence, the transgressive wit—that have inspired generations of readers not just to look differently at the world around them but to find the confidence to say something about it. Authors as wide-ranging as Norman Mailer, John Irving, Michael Crichton, Tim O’Brien, Margaret Atwood, Elizabeth Strout, David Sedaris, Jennifer Egan, and J. K. Rowling have all found inspiration in Vonnegut’s words. Jonathan Safran Foer has described Vonnegut as “the kind of writer who made people—young people especially—want to write.” George Saunders has declared Vonnegut to be “the great, urgent, passionate American writer of our century, who offers us . . . a model of the kind of compassionate thinking that might yet save us from ourselves.”

More than fifty years after its initial publication at the height of the Vietnam War, Vonnegut’s portrayal of political disillusionment, PTSD, and postwar anxiety feels as relevant, darkly humorous, and profoundly affecting as ever, an enduring beacon through our own era’s uncertainties.
Slaughterhouse-Five, or, The Children's Crusade: A Duty-Dance with Death is a 1969 semi-autobiographic science fiction-infused anti-war novel by Kurt Vonnegut.
"
16,18,0312980140,3.4831460674157304,Seven Up (A Stephanie Plum Novel),Janet Evanovich,2002,St. Martin's Paperbacks,http://images.amazon.com/images/P/0312980140.01.THUMBZZZ.jpg,http://images.amazon.com/images/P/0312980140.01.MZZZZZZZ.jpg,http://images.amazon.com/images/P/0312980140.01.LZZZZZZZ.jpg,"
The smash-hit #1 bestselling author Janet Evanovich takes you on the ride of your life in the next Stephanie Plum adventure, Seven Up!

Semiretired mob guy Eddie DeCooch is caught trafficking contraband cigarettes through Trenton, New Jersey. When DeCooch fails to show for a court appearance, bond enforcement agent Stephanie Plum is assigned the task of finding him and dragging his decrepit ass back to jail. Not such an easy job, it turns out, since DeCooch has learned a lot of tricks over the years and isn't afraid to use his gun. He's already shot Loretta Ricci, an innocent old lady, and left her for worm food in his shed. He wouldn't mind shooting Stephanie next.

Likeable losers (and Steph's former high school classmates) Walter ""MoonMan"" Dunphy and Dougie ""The Dealer"" Kruper have inadvertently become involved with DeCooch. They've gotten sucked into an operation that is much more than simple cigarette smuggling and holds risks far greater than anyone could have imagined.

When Dougie disappears, Steph goes into search mode. When Mooner disappears, she calls in the heavy artillery and asks master bounty hunter Ranger for help. Ranger's price for the job? One night with Stephanie, dusk to dawn. Not information she wants to share with her sometime live-in roommate, vice cop Joe Morelli,

A typical dilemma in the world of Plum.

And on the homefront, Stephanie's ""perfect"" sister, Valerie, has decided to move back to Trenton, bringing her two kids from hell with her. Grandma Mazur is asking questions about being a lesbian, and Bob, the bulimic dog, is eating everything in sight--including the furniture.

Mud wrestling, motorcycles, fast cars, fast food, and fast men. It's Janet Evanovich's Seven Up.
Seven Up is the seventh novel by Janet Evanovich in her series featuring bounty hunter Stephanie Plum. It was published in 2001.
"
17,19,0786868716,3.4827586206896552,The Five People You Meet in Heaven,Mitch Albom,2003,Hyperion,http://images.amazon.com/images/P/0786868716.01.THUMBZZZ.jpg,http://images.amazon.com/images/P/0786868716.01.MZZZZZZZ.jpg,http://images.amazon.com/images/P/0786868716.01.LZZZZZZZ.jpg,"
A STUNNING 20TH ANNIVERSARY EDITION OF THE MASTER STORYTELLER'S INSPIRATIONAL CLASSIC

Eddie no longer notices years passing. He spends his eighty-third birthday fixing the rides at the amusement park where he has worked for most of his life.

But when a cart falls from the fairground, Eddie spots a little girl in terrible danger. He rushes to save her and tragically loses his own life in the attempt.

When Eddie wakes, he discovers that death is an opportunity to learn about life, and he will have five teachers. Some he knows, while others are strangers. One by one, these individuals visit Eddie, illuminating the mysteries of his 'meaningless' existence and revealing the secret behind the eternal question: 'Why was I here?'
__________

WHAT READERS SAY ABOUT THE FIVE PEOPLE YOU MEET IN HEAVEN

'Breathtakingly beautiful. A story that will stay with you forever'

'A beautiful and flawlessly choreographed book . . . No other book may ever compare'

'One of my favourite books . . . Wonderful, inspirational, and heart-warming! To me, it is a MUST READ!

'The book is beyond words . . . Well written, engaging, poignant'

'This really is a wonderful book. You should read it'
The Five People You Meet In Heaven is a 2003 novel by Mitch Albom. It follows the life and death of a ride mechanic named Eddie who is killed in an amusement park accident and sent to heaven, where he encounters five people who had a significant impact on him while he was alive.
"
